{
  "$schema": "https://json-schema.org/draft/2020-12/schema",
  "$id": "https://github.com/AlbanAndrieu/nabla-compose/catalog/service-topology.schema.json",
  "title": "Nabla declared service topology",
  "type": "object",
  "additionalProperties": false,
  "required": ["version", "name", "nodes", "relations"],
  "properties": {
    "$schema": { "type": "string" },
    "version": { "type": "integer", "minimum": 1 },
    "name": { "type": "string", "minLength": 1 },
    "nodes": {
      "type": "array",
      "items": { "$ref": "#/$defs/node" }
    },
    "relations": {
      "type": "array",
      "items": { "$ref": "#/$defs/relation" }
    }
  },
  "$defs": {
    "identifier": {
      "type": "string",
      "pattern": "^[a-z0-9]+(?:-[a-z0-9]+)*$"
    },
    "environment": {
      "type": "object",
      "additionalProperties": false,
      "required": ["name", "url", "external", "cloudflareTunnel"],
      "properties": {
        "name": { "type": "string", "minLength": 1 },
        "url": { "type": "string", "format": "uri" },
        "external": { "type": "boolean" },
        "cloudflareTunnel": { "type": "boolean" }
      }
    },
    "runtime": {
      "type": "object",
      "additionalProperties": false,
      "required": ["provider"],
      "properties": {
        "provider": {
          "type": "string",
          "enum": ["truenas-app", "truenas-vm", "logical", "external", "host"]
        },
        "appId": { "type": "string", "minLength": 1 },
        "containerService": { "type": "string", "minLength": 1 },
        "instances": {
          "type": "array",
          "minItems": 1,
          "uniqueItems": true,
          "items": { "type": "string", "minLength": 1 }
        },
        "networks": {
          "type": "array",
          "minItems": 1,
          "uniqueItems": true,
          "items": { "type": "string", "minLength": 1 }
        }
      }
    },
    "lifecycle": {
      "type": "object",
      "additionalProperties": false,
      "required": ["phase", "priority"],
      "properties": {
        "phase": {
          "enum": [
            "bootstrap-runtime",
            "foundation",
            "network-edge",
            "primary-data",
            "secondary-data",
            "platform-services",
            "applications"
          ]
        },
        "priority": { "type": "integer", "minimum": 0, "maximum": 1000 },
        "blocksLaterWaves": { "type": "boolean" }
      }
    },
    "monitoring": {
      "type": "object",
      "additionalProperties": false,
      "required": ["type"],
      "properties": {
        "type": { "enum": ["http", "port", "provider"] },
        "target": { "type": "string", "minLength": 1 },
        "url": { "type": "string", "minLength": 1 },
        "host": { "type": "string", "minLength": 1 },
        "port": { "type": "integer", "minimum": 1, "maximum": 65535 },
        "conditions": {
          "type": "array",
          "items": { "type": "string", "minLength": 1 }
        }
      }
    },
    "node": {
      "type": "object",
      "additionalProperties": false,
      "required": ["id", "name", "kind", "category"],
      "properties": {
        "id": { "$ref": "#/$defs/identifier" },
        "name": { "type": "string", "minLength": 1 },
        "kind": { "type": "string", "minLength": 1 },
        "category": { "type": "string", "minLength": 1 },
        "presentationRole": { "enum": ["service", "core", "support"] },
        "criticality": { "enum": ["critical", "high", "medium", "low"] },
        "status": { "enum": ["active", "planned", "disabled"] },
        "securityFunctions": {
          "type": "array",
          "minItems": 1,
          "uniqueItems": true,
          "items": {
            "enum": [
              "govern",
              "identify",
              "protect",
              "detect",
              "respond",
              "recover"
            ]
          }
        },
        "sourcePath": { "type": "string", "minLength": 1 },
        "url": { "type": "string", "format": "uri" },
        "internalUrl": { "type": "string", "format": "uri" },
        "environments": {
          "type": "array",
          "minItems": 1,
          "items": { "$ref": "#/$defs/environment" }
        },
        "description": { "type": "string" },
        "icon": { "type": "string", "minLength": 1 },
        "runtime": { "$ref": "#/$defs/runtime" },
        "lifecycle": { "$ref": "#/$defs/lifecycle" },
        "monitoring": { "$ref": "#/$defs/monitoring" }
      }
    },
    "relation": {
      "type": "object",
      "additionalProperties": false,
      "required": ["source", "target", "type", "strength", "evidence"],
      "properties": {
        "source": { "$ref": "#/$defs/identifier" },
        "target": { "$ref": "#/$defs/identifier" },
        "type": {
          "enum": [
            "dependsOn",
            "consumesApi",
            "providesApi",
            "partOf",
            "hostedBy",
            "routesTo",
            "observedBy",
            "storesIn",
            "authenticatesVia",
            "exposedBy",
            "automates"
          ]
        },
        "strength": { "enum": ["required", "optional"] },
        "description": { "type": "string" },
        "evidence": {
          "type": "array",
          "minItems": 1,
          "uniqueItems": true,
          "items": { "type": "string", "minLength": 1 }
        }
      }
    }
  }
}
