{
  "version": 1,
  "name": "Nabla homelab static topology extensions",
  "nodes": [
    {
      "id": "kubernetes",
      "name": "Kubernetes (Talos)",
      "kind": "orchestrator",
      "category": "infrastructure",
      "sourcePath": "docs/truenas-talos-bootstrap.md",
      "description": "Target Kubernetes cluster bootstrapped on Talos Linux VMs hosted by TrueNAS.",
      "icon": "☸️",
      "presentationRole": "core",
      "criticality": "critical"
    },
    {
      "id": "etcd",
      "name": "etcd",
      "kind": "control-plane-store",
      "category": "infrastructure",
      "presentationRole": "core",
      "sourcePath": "docs/homelab-health-observability.md",
      "description": "Critical Kubernetes control-plane state store managed by Talos on control-plane nodes.",
      "icon": "🗄️"
    },
    {
      "id": "clamav",
      "name": "ClamAV",
      "kind": "antivirus-engine",
      "category": "security",
      "sourcePath": "catalog/homelab-services.json",
      "url": "https://clamav.albandrieu.com",
      "internalUrl": "https://clamav.int.albandrieu.com",
      "description": "Internal ClamAV/clamd service. The .int URL is the private DNS identity; functional health remains a TCP/3310 probe.",
      "presentationRole": "support",
      "criticality": "high",
      "securityFunctions": ["protect", "detect"]
    },
    {
      "id": "adguard-home",
      "name": "AdGuard Home",
      "kind": "native-truenas-dns-filter",
      "category": "network",
      "sourcePath": "catalog/homelab-services.json",
      "description": "Native TrueNAS App for network DNS filtering. It remains runtime-owned by TrueNAS until migration to repository-owned Compose.",
      "runtime": {
        "provider": "truenas-app",
        "appId": "adguard-home"
      },
      "lifecycle": {
        "phase": "foundation",
        "priority": 10
      }
    },
    {
      "id": "postgresql",
      "name": "PostgreSQL",
      "kind": "native-truenas-database",
      "category": "data",
      "sourcePath": "catalog/homelab-services.json",
      "description": "Shared native TrueNAS PostgreSQL App used by repository-managed consumers. Keep it as a runtime-owned native service until migration to repository-owned Compose.",
      "runtime": {
        "provider": "truenas-app",
        "appId": "postgres"
      },
      "lifecycle": {
        "phase": "primary-data",
        "priority": 20
      }
    },
    {
      "id": "talos",
      "name": "Talos Linux",
      "kind": "kubernetes-os",
      "category": "infrastructure",
      "sourcePath": "docs/truenas-talos-bootstrap.md",
      "description": "Immutable Talos Linux platform for the Kubernetes control-plane and worker VMs on TrueNAS.",
      "icon": "🔷",
      "presentationRole": "core",
      "criticality": "critical",
      "runtime": {
        "provider": "truenas-vm",
        "instances": [
          "taloscp01",
          "taloswk01",
          "taloswk02"
        ]
      },
      "monitoring": {
        "type": "provider",
        "target": "truenas:vm.query",
        "conditions": [
          "taloscp01=RUNNING",
          "taloswk01=RUNNING",
          "taloswk02=RUNNING"
        ]
      }
    },
    {
      "id": "cloudflared",
      "name": "Cloudflare Tunnel Connector",
      "kind": "tunnel-connector",
      "category": "network",
      "sourcePath": "docs/dns-ingress-ownership.md",
      "description": "TrueNAS-hosted cloudflared connector for outbound-established Cloudflare Tunnel ingress that bypasses Traefik.",
      "presentationRole": "support",
      "criticality": "high"
    },
    {
      "id": "heimdall",
      "name": "Heimdall",
      "kind": "dashboard",
      "category": "operations",
      "sourcePath": "catalog/homelab-services.json",
      "url": "https://heimdall.albandrieu.com",
      "description": "Application dashboard retained from the legacy homelab inventory and classified canonically for topology consumers.",
      "presentationRole": "support",
      "criticality": "low"
    },
    {
      "id": "pfsense-unbound",
      "name": "pfSense Unbound",
      "kind": "dns-resolver",
      "category": "network",
      "sourcePath": "docs/dns-ingress-ownership.md",
      "description": "Primary LAN recursive resolver at 172.17.0.1:53; delegates int.albandrieu.com to Pi-hole with Forwarding Mode disabled and outgoing interfaces set to All.",
      "presentationRole": "core",
      "criticality": "critical",
      "monitoring": {
        "type": "port",
        "host": "172.17.0.1",
        "port": 53,
        "target": "tcp://172.17.0.1:53"
      }
    }
  ],
  "relations": [
    {
      "source": "kubernetes",
      "target": "etcd",
      "type": "dependsOn",
      "strength": "required",
      "description": "Kubernetes control-plane availability depends on a healthy etcd state store.",
      "evidence": [
        "docs/homelab-health-observability.md:etcd direct health gate and control-plane criticality"
      ]
    },
    {
      "source": "kubernetes",
      "target": "talos",
      "type": "hostedBy",
      "strength": "required",
      "description": "The Kubernetes cluster runs on Talos Linux control-plane and worker nodes.",
      "evidence": [
        "docs/truenas-talos-bootstrap.md:default Talos VM topology and bootstrap sequence"
      ]
    },
    {
      "source": "etcd",
      "target": "talos",
      "type": "hostedBy",
      "strength": "required",
      "description": "Talos control-plane nodes host the etcd member(s) backing Kubernetes.",
      "evidence": [
        "docs/homelab-health-observability.md:current Talos control-plane and etcd topology"
      ]
    },
    {
      "source": "talos",
      "target": "truenas",
      "type": "hostedBy",
      "strength": "required",
      "description": "Talos control-plane and worker nodes are provisioned as VMs on TrueNAS.",
      "evidence": [
        "docs/truenas-talos-bootstrap.md:TrueNAS VM bridge and default Talos VM topology",
        "terraform/truenas/main.tf:truenas_vm"
      ]
    },
    {
      "source": "pfsense-unbound",
      "target": "pihole",
      "type": "dependsOn",
      "strength": "required",
      "description": "Private int.albandrieu.com resolution through pfSense/Unbound depends on the Pi-hole authority at 172.17.0.24:53; public recursion remains independent.",
      "evidence": [
        "docs/dns-ingress-ownership.md:Resolver architecture and precedence",
        "docs/dns-ingress-ownership.md:pfSense / Unbound"
      ]
    }
  ]
}
